股票代码,页码,标题,时间
300001,1,k线不规律，涨时你不发表评论，跌你就出来博存在，你都说了不看好清仓了，还在这干嘛,04-03 05:48
300001,1,利好特锐德，巩固龙头地位，加速出清。,04-04 07:54
300001,1,加仓，是壳到底,04-03 04:02
300001,1,这股的融资盘肯定不是中长线，因为可能挣的都不够付利息的,04-04 11:34
300001,1,特锐德赴港上市,03-30 10:20
300001,1,大家都亏，不叫亏。,04-03 09:50
300001,1,不行就清仓，都别骂了，4800只股票一个月的走势都一样，而且有一半的股票跌了一个,04-03 09:50
300001,1,早点倒闭,04-03 09:34
300001,1,20以下搞搞还行,04-03 07:01
300001,1,$特锐德(SZ300001)$,04-03 07:01
300001,1,昨天跑了，买了恒为科技，特锐德亏的，在那边补回来了,04-03 05:58
300001,1,这位置又有不少人跑路了,04-03 09:25
300001,1,k狗在合盛硅业，迈瑞医疗亏的惨不忍睹？,04-03 02:55
300001,1,赶紧撤吧，最后的逃跑机会，下周年报一出，直接跌停。,04-03 02:49
300001,1,一个月跌了30个点，一点都没回头,04-03 02:39
300001,1,跌了30个点毫无反弹迹象………威腾电气20CM封板永远不会出现在特锐德身上，太惨,04-03 11:13
300001,1,反正你上不去就不能下个25吗顺带补补去年缺口啥的,04-03 02:14
300001,1,“A+H”股热潮延续！1月累计18家A股上市公司筹划赴港上市，矿业龙头兴业银锡在列,02-01 07:30
300001,1,破了924以来的趋势，就是破了此叙事逻辑。,04-03 01:24
300001,1,开盘就跑果然对,04-03 12:21
300001,1,这么惨烈的下跌，窝草,04-03 12:18
300001,1,只跌不涨，跟去港ipo有关系吗,04-03 10:37
300001,1,26元以下加仓等年报,04-03 11:40
300001,1,自动删除骂人的话！你设计好,04-03 11:25
300001,1,要跌，就爽快点,04-03 11:24
300001,1,特锐亏到连妈都认不得,04-03 11:12
300001,1,为什么不能,04-03 11:08
300001,1,这熟悉的配方又来了,04-03 09:56
300001,1,24等你，进半仓,04-03 10:42
300001,1,天天跌,04-03 10:25
300001,1,老子在250线等你,04-03 10:25
300001,1,踩准节奏，一起玩转特锐德。别痴情，放弃一厢情愿。,04-03 10:21
300001,1,板块最拉圾,04-03 10:19
300001,1,特锐德：融资净买入203.69万元，融资余额15.94亿元,04-03 09:03
300001,1,现如今的形势没有什么朝阳行业了，明天全换成你，锁仓半年，输了认输销户！,04-02 11:20
300001,1,a股一直如此，越是业绩好，越是跌。看看大连重工，订单做不完，业绩前天就报出来增长,04-03 04:27
300001,1,又中标了。哈哈哈哈哈,04-03 12:59
300001,1,特锐德：预中标预制舱变电站项目,04-01 07:11
300001,1,5线炸菊花，不信邪的拿几个月，不腰斩才怪！,04-02 11:06
300001,1,福田汽车：公司与宁德时代、亿纬锂能分别成立合资公司，开展新能源电池经营性租赁业务,04-02 03:49
300001,1,$特锐德(SZ300001)$,04-02 08:32
300001,1,此时不买更待何时？很难有这种机会存在了。回调敢于出手，静候佳音即可。,04-02 02:21
300001,1,走了，这个公司今年信誉和资产计提减值,04-01 11:14
300001,1,天时地利，这油价欧洲市场不去搞一下,04-02 05:40
300001,1,你还是别去谈合同了中标没好事,04-02 04:02
300001,1,中标如中炮，天天中，天天被炮击,04-02 03:54
300001,1,31.5元进的，亏惨了,04-02 03:52
300001,1,"明年此时st,后年退市。充电桩是第二个房地产行业！跌到1块钱都不能抄底，因为3板",04-02 02:20
300001,1,中镖小能手,04-02 03:08
300001,1,加了点，主力让吃肉不,04-02 02:15
300001,1,特锐德公司你们难道做的是亏本工程？怎么一中标就下跌。,04-02 11:27
300001,1,无量，没有资金看好,04-02 02:22
300001,1,左右这样倒，累不累，不要成本吗？,04-02 02:21
300001,1,这货今天又可以入了继续游击战，薅庄家羊毛,04-01 02:44
300001,1,连续两天跌停年报不及预期,04-02 01:57
300001,1,从高点已经回调33%,04-02 02:09
300001,1,250日线满融接,04-02 02:15
300001,1,这股一中标第二天就大跌,04-02 10:31
300001,1,一万个,04-02 01:52
300001,1,每次下跌你都是第一名,04-02 01:36
300001,1,上涨没有你，下跌你不落后,04-02 01:47
300001,1,年报业绩不及预期，年报第二天又会跟去年一样暴跌十几个点,04-02 01:34
300001,1,千亿龙头涨停，“三天两头接订单”中国证券报23分钟前你真是个笑话,04-02 12:50
300001,1,特锐德庄家应该改名叫特不靠谱了，差价你也做了，明天再不拉说明真有问题。,04-02 01:24
300001,1,我求求你了，破产了，每次中标都下跌，还有天理吗,04-02 10:45
300001,1,目标25.3附近,04-02 12:15
300001,1,一说利好赶紧跑,04-02 11:38
300001,1,中标，天天中镖,04-02 11:33
300001,1,我卡里留好了3100块，继续,04-02 11:29
300001,1,签2亿爹2个点，合理！,04-02 11:23
300001,1,1人抄底，百人抄你下三路,03-30 10:11
300001,1,从周线月线看，只要财报不拉胯，差不多也快到底了,04-02 11:18
300001,1,标题不错，就是股价不行,04-02 10:52
300001,1,报复性反弹开启！,04-01 08:58
300001,1,同样是储能，你看看新中港，格局啊,04-02 10:33
300001,2,估计和阳光电源一样的走势,04-02 01:41
300001,2,带特都不行,04-02 01:35
300001,2,继续跌啊，拿了3年，我18的本，拿不住的就走，我看到100,04-02 11:16
300001,2,做个人吧,04-02 10:10
300001,2,真垃圾,04-02 10:25
300001,2,中标如中枪，从不爽约。!!!,04-02 10:15
300001,2,年报不及预期吗？,04-02 10:01
300001,2,主要还是没资金看上，这个老庄吃像难看,04-02 10:22
300001,2,真踏马垃圾股，,04-02 09:54
300001,2,量化全,04-02 09:52
300001,2,特锐德：关于预中标预制舱变电站项目的提示性公告,04-01 10:08
300001,2,说什么我也不信这种走势的股票短期内能起得来！最少还得跌一个月！,04-02 09:53
300001,2,各位有情怀的股东们，给你们打打鸡血…………以前发中标消息时，第二天基本上都是下跌,04-02 01:20
300001,2,毒标……曹了,04-02 09:35
300001,2,新能源汽车大福回升，高层考察绿电，你还没点数嘛,04-02 08:12
300001,2,特锐德:关于项目预中标的提示性公告,03-30 06:11
300001,2,又中标2个亿，算了一下，平均一天一个亿,04-01 05:50
300001,2,特锐德：融资净偿还75.11万元，融资余额15.92亿元,04-02 08:53
300001,2,特锐德:关于预中标预制舱变电站项目的提示性公告,04-01 05:33
300001,2,明天涨停,04-01 08:26
300001,2,3月以来，全国多地公共充电桩价格波动，热门点位高峰时段电价涨幅大，引发全网热议。,04-01 11:46
300001,2,充电桩涨价潮来袭？呵呵了,04-01 08:42
300001,2,三四月份历来是特锐德最艰难的时段，特锐德能够改写这个宿命吗？,03-29 09:15
300001,2,我就看着你不相信你不涨,04-01 09:47
300001,2,总资产250亿市值才这么点,04-01 08:41
300001,2,最近看到两次集合竞价跌停了，是为了告诉我们股价由你们操纵吗？,04-01 08:28
300001,2,A股上市公司已披露年报业绩概况,04-01 08:42
300001,2,可以进吧,04-01 02:30
300001,2,中标如中毒,04-01 06:51
300001,2,这个目前比便宜多了,04-01 06:43
300001,2,对于该股长期在竞价9.15到9.20期间跌停恐吓散户，虚假交易，故意控价行为，已,04-01 04:02
300001,2,2月10号到现在大概中了19亿的标，意义不大，都是国内的，等来个10亿的海外订单,04-01 06:28
300001,2,请大家都问问特锐德公司，公司只发布预中标，从不发布预中标已中标，是不是预中标就是,04-01 06:20
300001,2,三个点没走可惜了,04-01 06:04
300001,2,“创业板第一股”特锐德冲击港股,03-06 07:07
300001,2,我被骗了唉,04-01 01:56
300001,2,李莲英的孙子今天又在集合竞价打跌停板了。,04-01 09:21
300001,2,集合竞价打跌停板的你有种出来露个脸，给你祖宗烧个香。,04-01 03:03
300001,2,少赚了的…………建议调仓换股…………,04-01 02:33
300001,2,买买买买定离手哈哈,04-01 02:10
300001,2,特锐德：高增长受益于抢装潮 重金打造的特来电地位尴尬,04-01 11:02
300001,2,开始抽风,04-01 01:28
300001,2,78股连续5日或5日以上获融资净买入,04-01 11:39
300001,2,融资盘太多了…………谨慎操作……………按目前的股价，比较理想的融资额应该在12～,04-01 10:03
300001,2,大盘反弹上去了，指数可以上4000，4100，4200等等，该股却在压盘，砸盘！,04-01 10:36
300001,2,兄弟你die了么，大盘小跌你大跌，大盘大涨你跳水,04-01 10:31
300001,2,垃圾还是垃圾,04-01 10:30
300001,2,那个啥瞎搞了，有本事别撤，撤了你,04-01 09:18
300001,2,大概率又是空欢喜一场,04-01 09:24
300001,2,集合竞价打跌停板的，,04-01 09:20
300001,2,的女子今天又在集合竞价打跌停板了。,04-01 09:22
300001,2,清一半，开盘就下来,04-01 09:22
300001,2,撤单的，呀。,04-01 09:20
300001,2,都不知道你们怕什么这位置就是最好的上车点位,03-31 07:57
300001,2,-20你牛,04-01 09:18
300001,2,跌停了,04-01 09:18
300001,2,【特锐德标讯】中广核新能源2026年度箱变设备框架采购1/2/3/4/5标段,03-31 08:48
300001,2,特锐德：融资净买入409万元，融资余额15.93亿元,04-01 09:02
300001,2,祝贺特锐德过前高32.19元！,03-06 09:53
300001,2,十年新建铁路3.5万公里！铁路基建多股涨停 融资客抢筹股曝光,03-31 12:04
300001,2,少碰青岛企业,03-31 10:43
300001,2,香港上市之前，股票价格只跌不涨,03-31 10:39
300001,2,天天中标，天天跌，希望以后千万别在中了,03-31 11:02
300001,2,果然还是每次中标都下跌,03-31 03:31
300001,2,【中标信息】中广核新能源2026年度箱变设备框架采购第一至第五标段预计中标2.5,03-31 05:35
300001,2,继续加一点,03-31 01:49
300001,2,为了港股上市不择手段砸盘。控价！不可能二级市场操盘没有联系！举报到证监会！等着人,03-31 01:27
300001,2,不爆仓天理难容,03-31 03:05
300001,2,还有谁对特锐德情有独钟？,03-30 11:35
300001,2,33的时候我都没走，反而继续加仓。主力尽管洗，现在这个价位我更不可能卖。年底见，,03-31 10:51
300001,2,特拉几,03-31 01:26
300001,2,早点退市吧哥们,03-31 01:14
300001,2,特锐德有高铁概念啊…,03-31 10:52
300001,2,港股没机构买单的，从33.75到现在，已经跌没20%了。基本面太差，风险控制能力,03-31 11:02
300001,2,玩意,03-31 10:59
300002,1,上次大唐的官司，高庭半个月就驳回。今次3个月了都没反应，可能打回重审,04-04 10:57
300002,1,跟着老谢操，不得遭飞刀。下周节后开市必须大涨。,04-03 07:55
300002,1,被套19个点，补都懒得补了，无底洞,04-04 04:34
300002,1,看你这熊样，唉，亏死个人,04-04 01:48
300002,1,神州泰岳：公司不涉及算力硬件及算力租赁业务,04-03 09:10
300002,1,大盘2689点的时候，神州泰岳9.04，现在大盘3880点，神州泰岳9.27，说,04-03 09:22
300002,1,目前支撑位在《8.9》元处，能到否看中东局势。,04-03 04:14
300002,1,今天岳子挺硬,04-03 10:06
300002,1,你好董秘，能具体说一下公司相关的算力订单吗，谢谢,04-03 03:00
300002,1,大卫每天公布股东人数舍意思，没有其它公布了吗,04-03 11:03
300002,1,难道7.73是你的底？？？,04-03 06:54
300002,1,底部一定是多空激战后的单针探底或者多针探底，还有一种是结构底，目前来看神州还没见,04-03 03:45
300002,1,散户的钱都快被吸干净了，你没看见吗？,04-03 06:16
300002,1,上周五临近收盘，我就发了本周不乐观的预计，结果本周走势就是带上影线下跌小锤，按这,04-03 03:09
300002,1,这几天好像没看到213股友发表了,04-03 03:15
300002,1,诉讼官司估计够呛，弄不好又要吐出来。,04-03 04:46
300002,1,大盘往3000点方向去了,04-03 04:05
300002,1,尾盘想随点意思意思，它竟然不让我意思，那就没意思了，下礼拜看情况再意思吧,04-03 03:27
300002,1,除非再有业绩有关的利空，这几天K8已经不太可能破九了当然也不意味着一直都不会，不,04-03 10:59
300002,1,长痛不如短痛，走吧,04-03 02:34
300002,1,下周不跌,04-03 01:30
300002,1,无尽的抛压。无尽的卷,04-03 02:36
300002,1,尾盘拉升,04-03 02:27
300002,1,认输离场，走了,04-03 02:09
300002,1,昨天跌的有点猛，今天暂时休息一下，明天继续。,04-03 12:34
300002,1,今天不错哦,04-03 01:40
300002,1,显眼包就是这样了，普跌大跌行情就发挥成份股维稳作用，市场反弹就补跌。,04-03 01:37
300002,1,今天跌幅不大，资金流入也不少，希望下周开盘能有个涨3%以上的涨幅,04-03 01:23
300002,1,下午会下台阶吗,04-03 12:23
300002,1,到底是哪些处升在疯狂的抛售，难道是社保的处升？,04-03 10:40
300002,1,有人说《泰岳》是黄昏的太阳，有人说它是黎明的睹光。没有风暴，船帆不过是一块破布。,04-02 07:42
300002,1,别看你的票今天涨，长期看股市是极大多数人亏的。是吸血的机器。,04-03 11:36
300002,1,今天十点之前的半小时还有9.45以上的价格，我已经出了一多半了现在就一万股，早盘,04-02 02:38
300002,1,这个人真口臭，一讲就跌了,04-03 11:16
300002,1,什么情况，今天居然不跟跌,04-03 11:13
300002,1,80%的股票都是绿的。你今天红了，显示你比别人都强，想让有钱的人来买吗？,04-03 11:01
300002,1,求下散户不是往里冲了！只有放大量再冲也不迟,04-03 10:57
300002,1,分时图多空单搞得像互相拼命一样的，真看笑了,04-03 10:39
300002,1,基金大幅减持，平台盘整后破掉9元,04-03 09:52
300002,1,这就对味了，早上看到红盘挺稀奇，跌吧，一起耗在里面，使劲跌大家一起完蛋，我一毛也,04-03 10:07
300002,1,举报电话:12386服务热线:稽查局举报电话：010-88060055、010-,04-03 10:23
300002,1,有诈，8块5铁订的,04-03 10:17
300002,1,走了走了,04-03 10:09
300002,1,幸亏是未加仓，不放量啥也别指望了,04-03 10:06
300002,1,下午必定大跳水！,04-03 09:42
300002,1,$神州泰岳(SZ300002)$,04-03 05:59
300002,1,清明劫,04-03 09:49
300002,1,今天要到九以下了,04-03 09:17
300002,1,神州泰岳：融资净买入15.18万元，融资余额15.66亿元,04-03 09:01
300002,1,郁闷怎么一直卖卖卖卖融券也要继续做空，原来是资本准备入场资本不会在高位入场。如果,04-03 01:35
300002,1,啥时候是个低？天天跌,04-03 12:00
300002,1,神州泰岳：截至2026年3月31日公司股东人数为108942户,04-02 06:43
300002,1,这票我觉得7块7附近应该有强支撑，或者反转,04-02 10:55
300002,1,明天再破9.17，只能等8.5了,04-02 07:38
300002,1,特乌鸦一说话油价爆涨，股价爆跌，明天看能不能收在9字头，,04-02 09:14
300002,1,为敬！,04-02 08:43
300002,1,老谢10.2元抄底300万，然后9.5割肉三分之一仓。最近老谢又满仓了。,03-31 12:28
300002,1,昨天散户买入，今天主力卖出。哎,04-02 04:06
300002,1,进来就被套,04-02 04:40
300002,1,怎么总是发布股东人数呀？？,04-02 04:50
300002,1,我先满仓，静等开花,04-02 04:57
300002,1,请问截至3月31日，公司股东人数多少？谢谢,04-02 03:33
300002,1,108942，这么多散户喜爱的票，星星之火可以燎原，冲锋号一旦响起来，就会前仆后,04-02 04:52
300002,1,前一次跌落到回升横了一个月,04-02 03:39
300002,1,已经三年没有过涨停了最近一次是23年3月底,04-02 03:07
300002,1,涨的时候垫底，跌的时候差一点点进跌幅榜，坚决等到6-8元区间把失去的都拿回来！,04-02 03:05
300002,1,9.35500万,04-02 01:51
300002,1,技术面就是长期下跌走势,04-02 02:52
300002,1,概念多的成了一锅粥，跌成狗了,04-02 02:45
300002,1,社保基金说，同志们！我没走，有事一起扛！,04-02 10:43
300002,1,全部是跑路了,04-02 02:43
300002,1,涨点割点吹一次大跌一次你是真垃圾东西,04-02 02:40
300002,2,在这里躲过25年的牛市，真系想喂死大喂这个孤儿仔,04-03 10:54
300002,2,只有公司股东在8万人时才有向上拉的机会,04-03 10:53
300002,2,你人家大卫是零成本的持票，大家怎样和他斗呢！还是放弃这个孤儿仔公司吧,04-03 10:48
300002,2,刍生股，,04-03 09:32
300002,2,$神州泰岳(SZ300002)$,04-03 06:03
300002,2,不管以怎样的方式开始，最后无一列外都以蛇尾收工。,04-02 02:32
300002,2,用资金买卖出来的价格，9.59附近就是天花板了，已经两次了，下跌就是9.18-9,04-02 10:28
300002,2,9.201000万,04-02 02:34
300002,2,多托股山吹股，未够一天跌,04-02 02:09
300002,2,放下执念，听其自然，放过自已。（2026.3.25）,03-25 02:49
300002,2,这种要死不活一直要到6月份，视新游戏正式上线时间及表现再来谈改变！！！,04-02 01:38
300002,2,分时图60/120分钟线又破位了，量化下后台数据是他们的操作依据，啥技术指标都失,04-02 01:36
300002,2,没人买又没卖，死水一潭，要等季报出,04-02 01:34
300002,2,今天又是全天最低价收盘？,04-02 01:08
300002,2,重复收盘一条龙，开盘一条虫,04-02 12:21
300002,2,不要对市场抱有幻想，8块5绝对会到,04-02 11:19
300002,2,nmd涨一天为了两天跌吧,04-02 09:37
300002,2,昨天基本是散户买卖,04-02 09:44
300002,2,差不多现在只有量化操作吧,04-02 11:10
300002,2,建议大家都去举报这个谢光耀，一会唱空，一会唱多，是狗托无疑。,04-01 05:12
300002,2,现在是最难受的时候，最主要是成交量没了，股价波幅小了，没方向感了,04-02 11:05
300002,2,举不起来了！！！,04-02 11:02
300002,2,把螃蟹抓回去就妥了，可能是某园跑出来的！！！,04-01 09:31
300002,2,老蟹，是不是你在砸盘？,04-02 10:10
300002,2,只要有吹一下这流氓股必跌,04-02 10:29
300002,2,慌什么，就一个小螃蟹喊7.7，就把你们吓成这个样子了？老霉的仗打不下去了，停战就,04-01 03:57
300002,2,买了你没涨过，跌20%了,04-02 10:01
300002,2,真是稳,04-02 10:15
300002,2,抓住这个窗口期，抓住抓住，明天早盘第一个半小时到一小时。。。千万别坐反了，有票的,04-01 10:29
300002,2,珍惜10元以下的泰岳，老谢躺着不动一天赚七八万，去年赶上牛市，躲过暴跌，才有机会,04-01 02:15
300002,2,多托吹股，小心昨天涨的不够两天跌,04-02 09:25
300002,2,神州泰岳：融资净偿还594.78万元，融资余额15.66亿元,04-02 09:04
300002,2,昨晚美股游戏股大涨，你也该表现一下了吧,04-02 08:58
300002,2,，有这个称呼谢的狗，肯定涨不了,04-02 08:13
300002,2,目前位置再度介入,04-02 04:30
300002,2,今天轮到神州泰岳涨停了,04-02 06:58
300002,2,这段时间光最后集合竞价都跌了三毛,04-01 03:17
300002,2,该加仓了,04-01 08:19
300002,2,$神州泰岳(SZ300002)$,04-01 09:43
300002,2,张雪机车爆火，如果我是公司管理层，就会积极抓住这一机会，将avavoAI语音数字,04-01 07:41
300002,2,等季报出来了。在加仓现在不着急的。。就算季报很差也有子弹加仓,04-01 07:32
300002,2,季报不容乐观，季报未出之前，就是雾都孤儿一个,04-01 02:25
300002,2,老蟹，赶紧的出来喊77,04-01 03:49
300002,2,6-8元才有机会赚钱，不要急！深套的也别动了，苟着,04-01 03:26
300002,2,恭喜太弱近19个交易日单日最高收涨2.47％,04-01 03:05
300002,2,量化呀,04-01 02:52
300002,2,都动不动就几万首买单，量化把持了吗？,04-01 02:52
300002,2,还得下来，没说的,04-01 02:49
300002,2,做个人吧，好好涨一点,04-01 01:08
300002,2,游戏板块就几个业绩增长性强的在大涨,04-01 02:43
300002,2,巨人都板了，你10个点总要有,04-01 02:33
300002,2,社保全都跑路了，基本面发生变化，资金不认可,04-01 01:36
300002,2,游戏涨那么多你也不跟啊，咋这么次呢？,04-01 02:22
300002,2,10.00200万,04-01 02:20
300002,2,完美涨停，这哥们不行呀，,04-01 02:19
300002,2,可能节后见分晓了，还有三个交易日，这个平台的时间就赶上上个10以上的平台的时间啦,04-01 02:16
300002,2,十日线真难攻克？,04-01 02:13
300002,2,板块涨了五个点了，这个四了。,04-01 01:46
300002,2,彻底废了,04-01 02:03
300002,2,9块6能吃下不？,04-01 01:44
300002,2,要起飞了,04-01 01:45
300002,2,无量，没戏，小散自己玩自己,04-01 01:35
300002,2,板块6个点,04-01 01:32
300002,2,越不涨越幻想,04-01 12:40
300002,2,不能放量么？,04-01 12:15
300002,2,9.49有1.3万是什么意思呀！,04-01 11:41
300002,2,大神州泰岳怒涨2.25%！,04-01 11:36
300002,2,这垃圾是多长时间没涨过三个点以上的了,04-01 11:27
300002,2,板块资金流入七个多亿了，你还是资金流出？,04-01 11:24
300002,2,9.55还是很难，哎，我的预测就不能不准一次吗，我等9.65再卖点，给个机会,04-01 10:39
300002,2,反弹的力度都不强,04-01 11:18
300002,2,现在就是散户跟游资（融资）在博弈！！！而机构都在等1季报，以便确认2款新游的进展,04-01 11:04
300002,2,没量没换手拿什么涨？，,04-01 10:46
300002,2,倒数第一,04-01 10:46
300002,2,无量是诱多,04-01 10:39
300003,1,韭们别再找利好了，没用的！你们也不想想，你找到的利好是不是主力机构早就知道了，既,04-04 08:40
300003,1,一个公司的股价涨不涨不是靠散户找利好自我安慰就会涨的，你找的所谓利好难道主力不知,04-04 09:50
300003,1,2026是脑机接发元年。各类利好会不断涌现,04-04 08:31
300003,1,$乐普医疗(SZ300003)$,04-04 09:53
300003,1,兄弟们别找利好了，求求你们了，跌的还不够惨吗,04-04 06:39
300003,1,老牛，，,04-03 11:13
300003,1,你发这些大篇文章。偏偏不卖。有能耐来割我。再跌又买回来。,04-04 09:54
300003,1,有些忽悠。居然爆粗口。叫散户们叫阿Q.真是无语。,04-04 08:04
300003,1,我不懂基本面不懂技术，什么都不懂！我只知道涨多了会跌，跌多了会涨，我就靠这一个最,04-03 09:26
300003,1,奶奶滴这票就5手还能被套，幸好没重仓,04-03 10:58
300003,1,找找利好骗骗自己。。开盘继续跌,04-03 07:26
300003,1,3400是肯定会到的，放心,04-03 08:45
300003,1,哪里有利好，只有量化,04-03 08:46
300003,1,这个是真垃圾，每次追都要挨揍，不管啥时候多大的点位,04-03 07:52
300003,1,早几天盈利4个点，今天就回吐回去了,04-03 07:01
300003,1,一天抄了几次的，吹牛的呢。,04-03 05:48
300003,1,收盘收最低价绝了一个墓碑线,04-03 03:59
300003,1,这市场到底谁赚钱,04-03 03:44
300003,1,跌你跌得多，涨的时候没涨回来，指数涨回来，钱没跟上,04-03 03:40
300003,1,越补越跌，无力吐槽了,04-03 03:26
300003,1,16.8试仓入开始向下分批建仓，能买多少看命运,04-01 02:37
300003,1,A股已经这么垃圾了，乐普医疗是极品,04-03 03:10
300003,1,乐普真是垃圾股,04-03 03:08
300003,1,坐等起飞,04-03 09:36
300003,1,我看跌，医药出海里程碑回款说明公司太缺钱，协议里猫腻太多，一旦达不到研发或者销售,04-03 03:02
300003,1,赶紧退市吧,04-03 03:03
300003,1,想一想，马上就要进入老龄化,03-28 01:32
300003,1,没有垃圾股只有我们这些垃圾人买垃圾股,04-03 02:59
300003,1,逐步转好,04-02 02:30
300003,1,8亿到12亿的利润！！,04-03 02:39
300003,1,别听这些哈儿吹。这股不T就是等死,04-03 02:38
300003,1,"医疗出口美国的规模非常小，不到1,000万。不到营业收入的1%您怕什么呢？！20",04-03 02:23
300003,1,16.18入,04-03 02:19
300003,1,百炼千锤一根针，一颠一倒市上行。眼睛长在屁股上，只认衣冠不认人。,04-03 02:07
300003,1,年报和季报一天发布，看来季报利润不太好。,04-03 11:49
300003,1,我曹，该涨不涨，跌起来一点不含糊。,04-03 01:52
300003,1,ST吧,04-03 01:47
300003,1,虽然美国那边业务基本没有，但是情绪很关键，今天肯定是大副低开拉高一点，然后往下砸,04-03 07:36
300003,1,昨天就说了，还得跌25-30%,04-03 01:03
300003,1,能发个4%的红包，两天就收回去。,04-03 01:08
300003,1,16.16入继续建仓,04-03 01:01
300003,1,中国产业资本该进场了，防止优质企业被内外资做局！,04-03 10:00
300003,1,去年最低点汪汪队1.3万亿进场。。。赚了5800亿走了，印花税赚了2万亿。。你们,04-03 10:19
300003,1,技术迎多项突破性进展 商业化进程加速 机构称国内脑机接口行业有望迎来DeepSeek时刻！,03-25 10:48
300003,1,又见狗牙式分时图、、、、、、,03-26 10:39
300003,1,终于有了创新药概念了。,04-02 06:15
300003,1,垃圾股啊,04-03 10:47
300003,1,为什么跌，因为我买了为什么又涨了，因为我卖了,04-03 10:29
300003,1,脑机接口站上风口，我们离“意念操控”还有多远？,03-30 09:54
300003,1,清仓了，回撤三分之二了，等15块多再回来,04-03 10:23
300003,1,未来的大牛股,04-03 10:21
300003,1,下午跌幅可能会扩大5到8个点,04-03 10:14
300003,1,回踩年线，15.61，慢慢熬吧,04-03 10:11
300003,1,加个创新药概念让我们下面吃,04-03 09:59
300003,1,看到了吧长得时候不跟。跌的时候加进入概念跟跌。这股真是绝了,04-03 09:38
300003,1,所有的利好只是他下跌途中的绊脚石。趋势已定，无法改变。,04-03 09:50
