股票代码,页码,标题,时间
300014,2,今天宁王也杀，一般情况宁王绝对稳的，原因就是开这会那会，光伏、储能，都是行业内公,04-03 03:09
300014,2,58涨到70的时候后悔那天59没买，今天又破60了，但是看看阳光电源这走势又不敢,04-03 03:10
300014,2,还不如竞价割少亏100,04-03 03:31
300014,2,油价越高，越利好锂电，别丢带筹码,04-03 03:28
300014,2,下个星期绝对到50,04-03 03:09
300014,2,九十多到五十马上四十这叫慢牛,04-03 02:40
300014,2,三十五天又要买单了,04-03 03:18
300014,2,靠,04-03 03:18
300014,2,都说这家伙今天要补跌，转债这事是哪个缺心眼决定的？现在我都不敢碰你了,04-03 03:12
300014,2,又要痛苦一段时间了,04-03 03:11
300014,2,市场中唯一的一个坚决做空的主力,04-03 03:03
300014,2,络锦红和流精成委托牛的林奇到处摇人给他们接盘，不然股价崩的更快,04-03 03:06
300014,2,这种无德公司，没有人会再相信,04-03 03:04
300014,2,从94跌到60基本上都腰斩了，所属板块和指数却还在高位。,04-03 03:04
300014,2,最后一分钟清仓越来越有含金量,04-03 02:44
300014,2,60.01继续加仓了，不信抄不到底,04-03 02:53
300014,2,想骂人的+1,04-03 03:00
300014,2,下周还要杀，宁王还要继续大杀的。,04-03 02:59
300014,2,收盘价创7个月新低,04-03 02:58
300014,2,58.5拿你,04-03 02:52
300014,2,主力太凶残了,04-03 02:52
300014,2,60保卫战,04-03 02:50
300014,2,不到五十，不足以平息机构的愤怒，不是钻不赚钱的问题，而是不能把人当猴耍。,04-03 02:51
300014,2,就这点量全是卖盘，会不会到52,04-03 02:50
300014,2,清仓清仓清仓清仓清仓清仓清仓清仓清仓,04-03 02:49
300014,2,亿纬锂能:关于提前赎回亿纬转债的第四次提示和控股股东、实际控制人持股比例被动稀释触及1%整数倍的公告,04-02 07:26
300014,2,老牛靠会员的权益换了天风的免费研报，忽悠会员说几百万买的，这么恶心,04-03 02:40
300014,2,你抄底，它抄家，双向奔赴乐哈哈。,04-03 02:43
300014,2,下到58元,04-03 02:42
300014,2,走了留下的发财,04-03 02:42
300014,2,走了破60就清了。。。,04-03 02:41
300014,2,太惨了最近,04-03 02:35
300014,2,老牛靠会员的权益换了天风的免费研报，忽悠会员说几百万买的，这么恶心,04-03 02:34
300014,2,都在走医药的老路,04-03 02:39
300014,2,你们耗着吧，我去别的地方了。这么多转股的过来，主力给他们抬轿子？想多了，短期是没,04-03 02:35
300014,2,@哈斯哈斯兄弟，我是看到你的名字才关注你的，你是那个满仓满融单吊一个那个哥们吗？,04-03 02:25
300014,2,刘金成夫妇已经在开香槟庆祝了，50亿的可转债通过骚操作无风险0成本进入口袋，比减,04-03 02:11
300014,2,30分钟与60分钟形成底背离了,04-03 02:32
300014,2,看年线能否企稳，,04-03 02:34
300014,2,恐慌盘都没出，不急，等跌破60后放量再考虑建仓,04-03 02:33
300014,2,刚买就止跌,04-03 02:31
300014,2,单边下挫，狠,04-03 02:31
300015,1,你这种走势，我怎么敢入手阿,04-04 10:28
300015,1,公司也没毛病啊，怎么会有这种跌法,04-04 12:38
300015,1,这股最大的雷就是商誉太高，小心年报计提,04-04 09:52
300015,1,不能买了，还没跌够！起码道八元附近去了,04-04 08:36
300015,1,爱尔眼科历史新低价9.05元！如果假如一旦打破打穿！那么重新寻找新的最低点,04-04 06:53
300015,1,2009年原始股1股如果长期持有，现在是46股。目前仍然是大赚特赚的。谁知道呢，,04-02 05:47
300015,1,是金子迟早会发光,04-04 03:57
300015,1,爱尔眼科，出来解释一下海洋故事会,04-04 02:34
300015,1,邦啊，二五年年报能分三块吗？这谢谢你，邦。,04-03 09:20
300015,1,剔除商誉每股一元多的净资产，股价到三、五元或可少量介入，管住手,04-04 11:52
300015,1,还能回到42吗,04-03 11:13
300015,1,陈邦不是人家想买你的票，而是都给你套太深了来来回回恶性循环一点反弹都没有只会分红,04-04 08:49
300015,1,不在沉默中暴发，就在沉默中灭亡。噢耶,04-04 07:26
300015,1,阴跌不止！10元难守,02-09 10:09
300015,1,来个大佬说说这票能进了不，历史新低了,04-03 11:44
300015,1,简直了,04-04 12:23
300015,1,上方套牢盘太多了，,04-04 12:17
300015,1,爱尔什么时候硬起点连拉两个板,04-02 09:43
300015,1,真的加仓加不动了，而且这个感觉跟以前不一样，感觉涨不上去了。,04-03 02:55
300015,1,放心大胆持有，这票的止损是9.5，下去了，散户没多大损失，但是有些人估计会相当的,04-02 01:12
300015,1,32的本什么时候能回。,04-03 08:18
300015,1,爱尔眼科怎么了？业绩尚可，为什么股价一直在跌。请问一下公司有什么对策？,04-02 05:28
300015,1,董秘好!公司股价已连续下跌五年之久，目前股价这个位置，公司依然买理财，没有考虑要,04-03 08:45
300015,1,这种公司，当时是怎么炒到大几千亿的,04-03 07:27
300015,1,13得本，什么时候能回来,04-03 04:02
300015,1,爱尔眼科：公司2025年报将于2026年4月24日披露,04-01 09:37
300015,1,11块抄的底，11.5没出，11出了，10.8进10.6出，10.6进10.4出,04-03 06:55
300015,1,舆论管理的很不错，股东们过节了，缺钱！！,04-03 07:35
300015,1,豆包说出所有人心声和现况。,04-03 05:12
300015,1,月线我看5浪没走完。我赌他能跌到4块5块,04-03 07:07
300015,1,抄底的人呢？继续抄啊……,04-03 07:05
300015,1,这玩意会退市吗？不退市就留给我孙子，不怕回不了本，就怕你退市,04-03 03:03
300015,1,满仓拿着6个月了，快奔溃了,04-03 02:51
300015,1,托是真的多，大家不要慌，耐心持有。,04-02 10:48
300015,1,下个星期二，要是破了八块八就没戏了,04-03 06:28
300015,1,大家深陷其中，我们小散请陈总吃饭吧！让陈总回购，拉一拉,04-03 02:17
300015,1,爱尔眼科有参与政府实行的近视普查的政策吗？如果有，对公司业绩是否有正向的盈利提升,04-03 05:09
300015,1,成本10.3何时解套？你们多少啊？,04-03 03:19
300015,1,跌的头昏眼花，一半仓位不知道是补仓好呢，还是装死好呢！,04-03 03:15
300015,1,爱尔眼科商誉从20亿到现在的80多亿，太可怕了。本来看他这个跌法狠好奇，这一查，,04-03 05:36
300015,1,来看看4年前的预判，不得不承认股吧里面有高人啊，说5元的大佬嘴巴也太毒了，佩服佩,02-19 01:11
300015,1,人在做，天在看！,04-03 04:58
300015,1,陈邦，你不回购不增持，不做管理那么大的老板就等着分红吗？任股票一直下来你确实是个,04-03 01:36
300015,1,到底是谁在再卖啊,04-03 04:30
300015,1,如何脱围，一是每下5个点补一点仓。二是拿住等时间催化，三是千万不要慌这个股不会崩,04-03 02:02
300015,1,让它洗，我们不但不卖还要加仓,04-03 10:46
300015,1,目标二十万，不容易，卧倒不动，昨天吃了个麦翅十翅桶加两杯可乐套餐，太好吃了，麦当,04-03 03:17
300015,1,嘛吧，嘛出来开心点，别憋坏了,04-03 03:57
300015,1,大家成本多少？,04-02 11:00
300015,1,哎，跌的胸闷天天,04-03 03:32
300015,1,....,04-03 03:25
300015,1,年报出来再说，商誉太高了,04-03 03:02
300015,1,此刻入手恰好时,04-03 03:05
300015,1,价值投资在爱尔眼科面前崩溃了，谁信谁傻,04-03 02:55
300015,1,有底气就继续砸啊！反正止损点就在那里,04-03 09:52
300015,1,21年吃酒喝药的白马股，大部分跌回甚至跌穿2024.9.24了，地产招保万金就不,04-03 02:44
300015,1,涨一点难上加难，,04-03 02:41
300015,1,没有半点反弹之力，散户都躺平了，主力只能一天天的砸，砸到退市，主力跟陈邦的价位都,04-03 02:37
300015,1,陈帮是有多没自信，,04-03 02:36
300015,1,8.80是铁底，放心吧,04-03 02:34
300015,1,好的，月线丢了，9.5只是说说，碰9.51已经完蛋！9块或许还有再见的机会，各位,04-03 02:30
300015,1,弱B股,04-03 01:47
300015,1,再跌一角爆仓,04-03 02:14
300015,1,没人敢买，没人敢砸！今天不动了，五层仓，拿一年计划不变。,04-03 01:33
300015,1,9.5十倍增仓t仓加量,04-03 02:08
300015,1,从去年三件事大跌1第三季度这里下滑跌2精神病医院时间跌3外围战争跌作为全球眼科龙,04-03 02:07
300015,1,这只股是被全部市场和主力一遗弃了吗,04-03 02:01
300015,1,我W，，，每天骂每天下，，，头疼！这两万股咋办！！！,04-03 01:32
300015,1,仙股,04-03 01:56
300015,1,不是我9.7刚进了100万股就这样？,04-03 11:35
300015,1,差不多了,04-03 01:35
300015,1,之前就听说牛市会亏的比熊市还多，这下子知道为什么了吧，我不卖你怎么割我，不好意思,04-03 11:36
300015,1,全是量化在搞。不能买，越买股价越便宜,04-03 01:25
300015,1,清明时节雨纷纷，路上股民欲断魂,04-03 01:14
300015,1,烂股无底,04-03 01:02
300015,1,陈邦，炒股以来最大的失败就是买了你的烂公司股票，不回购不市值管理就每年分红给自己,04-03 12:54
300015,1,什么时候，我怎么不知道，啥时候是个头啊,04-03 12:46
300015,1,9.24以前的价格了,04-03 12:01
300015,2,你好董秘，请问贵司在医疗反腐方面有没有相应的制度？,04-03 05:04
300015,2,为什么不给我融券了！没道理啊！我看到了20个点的利润空间,04-03 02:23
300015,2,接下来由券商带你杀一波，人家是破位回抽前低，又有充分的理由做空牟利了,04-03 02:06
300015,2,杀下来啊！好让我死心，腾挪资金干点其它事,04-03 01:58
300015,2,快点砸到7.1左右融券的赚饱再做多啊,04-03 11:45
300015,2,砸吧比银行股息率高就好！定存3年再补仓！,04-03 09:56
300015,2,跌吧，已经亏60%，这点跌幅就像挠痒痒，最好再腰斩一次！破罐子破摔了……,04-03 10:42
300015,2,光头节日快乐,04-03 11:19
300015,2,加油,04-03 11:17
300015,2,#炒股日记#,04-03 11:16
300015,2,价值投资英科医疗？爱尔眼科？偏偏选了你这个鸟毛。,04-03 11:12
300015,2,跌一块买一万，随意了，就这样吧,04-03 11:01
300015,2,爱尔主力太坏，凭什么把我的何氏眼科带下来？,04-03 10:59
300015,2,把这货处理了，买了天音控股，不知道能不能把这里的亏损赚回来,04-03 10:57
300015,2,主力走完了，今年太多解禁盘，散户不要买,04-03 10:53
300015,2,主力疯狂砸盘跑路的一天，看到8块钱,04-03 09:53
300015,2,如果能匝道9.4一下，反T能挣钱了,04-03 10:46
300015,2,铁公鸡公司,04-03 10:46
300015,2,目标二十万，静候佳音，绝味鸭脖100亿问题不大。,04-02 03:29
300015,2,我准备在三十分钟后买入2亿的爱尔股票,04-03 10:37
300015,2,主力别犹豫砸吧，破9最好，不破不立,04-03 10:37
300015,2,七号量化要被限制了。该如何走,04-03 10:36
300015,2,后天给主力和量化过节，给他们买点烟酒，祝他们节日快快乐乐,04-03 10:34
300015,2,后天给主力和量化过节，给他们买点烟酒，祝他们节日快快乐乐,04-03 10:31
300015,2,后天主力和量化过节，一定多吃点,04-03 10:28
300015,2,破9就有希望,04-03 10:26
300015,2,你爷涨的时候，你也没跟涨啊,04-03 10:25
300015,2,都在说商誉，打个比方，一本临床医学或者中医学的书才几十块，可是书里知识的价值肯定,04-03 10:19
300015,2,等到7-8元再考虑建仓打满,03-26 02:46
300015,2,别急分批,04-03 10:17
300015,2,出了业绩再说，这股目前没有脱离下跌行情,04-03 09:59
300015,2,现在不买3年见不到10块的筹码了,04-03 09:41
300015,2,幸亏开盘卖出去了，这货早晚得退市,04-03 09:57
300015,2,看这趋势，还要下台阶,04-03 10:10
300015,2,再创新低,04-03 10:06
300015,2,10.2的本，盈利问题不大,04-03 07:58
300015,2,又开始了，没完没了了,04-03 09:53
300015,2,又开始了，只要跌的好好的cro突然反弹，它就马上砸盘，每次都是,04-03 09:50
300015,2,牛比，眼科茅。,04-03 09:44
300015,2,年报季报希望不是大雷,04-03 04:03
300015,2,看看眼科龙头普瑞眼科,04-03 09:37
300015,2,慢慢熬慢慢洗吧！该躺平躺平！,04-03 09:36
300015,2,真是垃圾到家,04-03 09:36
300015,2,融券降了，差不多了,04-03 09:34
300015,2,底部反转,04-03 09:27
300015,2,你好董秘，上次您回复说在审议关于市值管理制度，请问这审议不用股东大会表决吗？请问,04-03 09:10
300015,2,有些人在等业绩，上汽顺丰这种还有很多跌了很多年的老登股业绩超级好的涨了吗？只有业,04-03 06:10
300015,2,爱尔眼科：融资净买入1606.05万元，融资余额21.29亿元,04-03 09:06
300015,2,创新药利空来了，这不得跟着大跌啊,04-03 07:23
300015,2,真的不知道造了什么孽，买到创业板最差的股票还没有之一,04-03 01:49
300015,2,20日均台头了再入场,04-03 01:27
300015,2,加仓干吧,04-02 11:41
300015,2,小跌我不买，1个点以上我才尾盘买点，现五层仓位拿一年计划不变,04-02 07:19
300015,2,三季节扣非净利润同比？,04-02 09:34
300015,2,我丈母娘做了个眼睛手术花了5万块。。爱尔眼科真黑，暴利啊。买它不要怕。暴利行业,04-02 04:21
300015,2,开始底部宽幅振荡，再坚持一两月,04-02 05:58
300015,2,买个两手，你都不放过我,04-02 05:39
300015,2,还没破9.24前价格，算很强了,04-02 02:41
300015,2,几年来每次到爱尔人山人海，，，，回到股市，一塌糊涂！！！！！,04-02 05:34
300015,2,底部启稳已确认,04-02 05:00
300015,2,空狗子白白忙活一天，临了还损失了做空筹码，看着就舒服,04-02 02:24
300015,2,突然发现所有的技术分析都是扯淡无效的！,04-02 03:31
300015,2,没有任何希望,04-02 03:27
300015,2,央视新闻报道：人工视网膜 有新突破 爱尔眼科有很多新技术可以做,04-02 03:05
300015,2,中证医疗权重没一个诗人，迈瑞医疗，联影医疗，爱尔眼科，爱美客，一个比一个能跌,04-02 02:56
300015,2,这题材那题材都是假的,04-02 03:11
300015,2,我就断定今天收盘绿。明天下杀阴包阳,04-02 03:06
300015,2,真是眼睛不好买了你，看来要去看医生了，9.64果断割肉离场，不管以后你如何我自认,04-02 02:53
300015,2,又套一批继续割,04-02 02:55
300015,2,大股灾难即将来临，小心为上！空仓了,04-02 02:55
300015,2,明天黑色星期五，猎杀时刻！看看爱尔是哎吆、还是哦嚯！,04-02 02:53
300015,2,感觉跌不动了,04-02 02:15
300015,2,主力继续砸盘，出不完的货,04-02 02:06
300015,2,9.6收盘，空狗子明天又要发威了，还是那句话9.5我放弃,04-02 02:39
300015,2,一脚踏空恨患近视，九块挂号爱尔眼科。《请添横批：,04-02 01:58
300015,2,量化只管天天赚钱，不管涨跌都能赚钱，就这样来回磨吧,04-02 02:35
300015,2,量化该充电费了,04-02 02:34
300015,2,一上一下，血被量化吸干了,04-02 02:23
300015,2,散户要买一点，万一止跌了呢,04-02 01:40
300015,2,破9吧，痛快点,04-02 02:09
300016,1,3月23号定增受理通过，交易所审核时间为3个工作日。已经过去10个工作日了，公司,04-04 05:03
300016,1,周五主力进场了，周一开始上升，立帖为证,04-04 10:55
300016,1,今天整个大盘普跌，又不止它跌。哎！大真是吃仁不吐g头,04-03 10:12
300016,1,北陆药业仍然在上升通道中,03-25 09:55
300016,1,这企业不行，富二代开拓能力还是差些,04-03 04:59
300016,1,板块突发利空，也到了调整的时候了，泥沙俱下。,04-03 12:44
300016,1,北陆药业:关于公司董事逝世的公告,03-30 04:59
300016,1,看看人家莱美，你真脏,04-03 01:08
300016,1,下星期最后一跌到9块6附近。出局。,04-03 02:06
300016,1,下午奔九去了,04-03 12:36
300016,1,怎么才能做空股，不行退市吧！反正这里面的钱不要了！,04-03 12:09
300016,1,一A股董事方志刚去世,03-30 06:14
300016,1,增发完成以后才会大涨,04-03 11:40
300016,1,板块涨的时候不跟，跌的时候第一,04-03 11:34
300016,1,下午破10元1/3仓，希望老庄给力！,04-03 11:19
300016,1,作为一家创新药创新发展见效的企业，人形机器人脑接口已投入运营，好事不断，股价不该,04-03 10:10
300016,1,就是没啥持续性这股，说不定哪天会涨停，但是直接就熄火，也挺折磨人的,04-03 10:38
300016,1,定增破发，9元都高看了。,04-03 10:18
300016,1,股,04-03 10:17
300016,1,等候9元附近,04-03 10:07
300016,1,昨天本想买莱美药业的，阴差阳错买了这垃圾，唉呀呀,04-03 09:59
300016,1,没什么关系,04-03 07:04
300016,1,这个死股，,04-03 09:54
300016,1,庄太笨，打压股票。,04-03 09:49
300016,1,涨没份跌你是不示弱拉级,04-03 09:49
300016,1,美国宣布将对进口专利药及制药成分加征100%关税，完蛋了,04-03 07:35
300016,1,2层北陆过节，其他全割了,04-03 09:45
300016,1,北陆真弱,04-03 09:40
300016,1,今天大跌！把散户通通消灭！一网打尽！一聚歼灭！,04-03 08:27
300016,1,不销往美国，没有影响。,04-03 08:16
300016,1,出口占比12%，不出口美国。,04-03 05:45
300016,1,这小陆。看不起老美。一点不卖老卖吖,04-03 08:06
300016,1,明天能不能给个跳空高开,04-02 09:59
300016,1,化药涨了好几天了，明天要调整了。北陆药业完全浪费了机会。,04-02 03:29
300016,1,消灭散户是必须的！！！明天给我杀跌！！！！！！,04-02 07:44
300016,1,赛升药业比北陆强多了，此公司富二代是吃货还牛人，年底见分晓。,04-02 05:11
300016,1,已经很强了！,04-02 04:23
300016,1,医药板块集体涨停！但是北陆不涨！不涨就要暴跌开始…跌停板伺候散户！消灭散户正当时,04-02 03:00
300016,1,我去金石亚药了，你俩一个价格，人家是红的。,04-02 03:02
300016,1,你欠各位股东一个涨停,04-02 02:39
300016,1,下周到9.5下方,04-02 02:05
300016,1,北陆,04-02 02:19
300016,1,能有利润就走人，现在的行情就是这个样,04-02 02:03
300016,1,就是压着，发现北陆人气只要进入一千以内，必定跌，每次都一样。反正他们就只做差价，,04-02 12:25
300016,1,金铲子,04-02 11:46
300016,1,七老八十了哈哈呀呀呀呀呀,04-02 11:30
300016,1,你是药吗？,04-02 11:13
300016,1,你这个逆板块的气质能不能改一改？,04-02 11:02
300016,1,自从加入了脑机接口和ai咱们北路就差好多，昨天化学制药涨停潮，脑机概念的一个涨停,04-02 10:54
300016,1,太烂拉级全版块最差的票,04-02 10:52
300016,1,为啥比板块差那么多呢,04-02 10:45
300016,1,就差几分钱，打死也不红，浪费板块行情,04-02 10:30
300016,1,太弱这股票不行,04-02 09:44
300016,1,幸好早上及时换舒神了，浪费两天行情,04-02 10:28
300016,1,$北陆药业(SZ300016)$,04-02 10:23
300016,1,你的大哥广生堂已经涨上天啦...,04-02 09:34
300016,1,美股脑机接口疯了,04-01 09:47
300016,1,今天下午14:00进，坐等明天20CM,04-01 03:43
300016,1,去年北陆和诺思兰德把我虐的不要不要的,04-01 09:02
300016,1,此股再不启动一波行情，我这十年苦攻估计就是白费了,04-01 01:09
300016,1,富二代接手，企业底子不错，老子创办企业是三家企业的二股东，一上市不差钱。关键是王,04-01 12:35
300016,1,焊死在46数字上,04-01 03:57
300016,1,尾盘买了，明天如何？,04-01 03:31
300016,1,明天继续,04-01 03:30
300016,1,好股慢慢来,04-01 02:54
300016,1,增发没搞定前，想都不要想会涨，以这股的尿性，每次上涨都是出货的时候,04-01 02:20
300016,1,别个医药股都涨停，你不涨一点点都没脸在心里待着！,04-01 02:43
300016,1,不过10.6不能跟的,04-01 10:44
300016,1,走了，太难受了！,04-01 02:16
300016,1,7个点的换手就爬这么点？,04-01 01:59
300016,1,你敢涨停我就敢卖,04-01 01:32
300016,1,收盘最多一个点，快换股吃肉,04-01 01:22
300016,1,今天能不能奇迹涨停,04-01 01:06
300016,1,这吊丝从来没有涨停过,04-01 12:37
300016,1,买进来才看见新闻，公司出这么大事，市值管理先放放，这股短期没戏了,04-01 10:31
300016,1,2026年首季呈现标志性季K线——倍量大阳线，意义重大。《北陆药业2026年首季,04-01 11:48
300016,1,舒泰神一样增发股价大涨，你增发就来砸股价，服了，卖了买别的创新药企业比大涨,04-01 11:44
300016,1,赶紧补缺口，好开始砸盘,04-01 10:49
300016,2,明天必须20厘米大跌停板消灭散户通通消灭！,04-01 03:10
300016,2,今天医药20%涨停了十几只这股太差劲,04-01 02:44
300016,2,太弱了,04-01 01:23
300016,2,医药这么多涨停板你确这么差劲太弱,04-01 01:22
300016,2,难道你不想当龙头吗，资源那么多，突破11.98啊,04-01 11:05
300016,2,这股也不争气医药版块20%的涨停好多只,04-01 10:34
300016,2,国际战事频发，国内防疫需求，这家企业医药创新创业发展见效，业绩好股价低，投行庄家,04-01 10:34
300016,2,今天最高点了，快跑,04-01 10:33
300016,2,庄家实力有限的很，指望着小散们给它抬轿子呢。,04-01 10:25
300016,2,来个涨停,04-01 10:23
300016,2,这个庄稼真病态...,04-01 09:55
300016,2,AI医疗创新药业龙头企业买买买！！！！！,04-01 09:47
300016,2,明天直接跌停板！！！通通杀光散户！,03-31 05:07
300016,2,该涨不涨继续表演接着,04-01 09:36
300016,2,今天跌停板！！消灭散户通通消灭干净！一聚歼灭,04-01 07:52
300016,2,明天能否来个涨停板,03-31 06:34
300016,2,三个涨停就够了,03-31 10:41
300016,2,明牌的票不会涨的韭菜鸡蛋同胞,03-31 07:50
300016,2,领导好！公众号《陆玉龙卓越企业研究》近日发文《北陆药业  中长线大牛股的八大逻辑,02-10 11:30
300016,2,北陆药业这票，明天能站稳1024就还有机会，站不稳就摔下去！大家周二验证,03-30 11:11
300016,2,这公司管理层怎么基本都是女士,03-31 05:45
300016,2,明日关注你,03-31 05:39
300016,2,我拉黑了个人，我想看看他最近说的啥，怎么招他啊,03-30 10:52
300016,2,按说完全可以来两根20厘米了，再有回调都是机会,03-31 07:19
300016,2,没有主力资金介入，都是小散户在捣鼓，再好的公司，再好的业绩都是没用的,03-31 10:02
300016,2,老那300手来砸盘是猪，已举报他，让证监会看看他有没有违规,03-31 10:30
300016,2,留有耐心，必有惊喜,03-31 10:28
300016,2,北陆药业拿了半年，没看它涨停过！真有点！,03-31 10:24
300016,2,今天必须得大跌暴跌！消灭散户通通消灭干净！一聚歼灭,03-31 10:00
300016,2,脑机和创新药板块都红还带不动你这废柴！,03-31 10:06
300016,2,感觉有戏了！,03-31 12:27
300016,2,明天还要杀！！！不把散户杀光我决不罢休！明天继续杀跌8个点！后天杀15个点！消灭,03-25 05:15
300016,2,今日必须消灭散户！！！跌停板…！,03-30 07:58
300016,2,这公司高管都是女的……,03-30 09:35
300016,2,种种迹像表明，北陆药业参股三剑客，有一家要亮剑。只能点到为止！,03-30 01:53
300016,2,那年出生的,03-30 08:25
300016,2,【北陆药业：董事方志刚因病逝世】3月30日，北陆药业公告，公司董事方志刚不幸因病,03-30 05:02
300016,2,北陆药业：董事方志刚因病逝世,03-30 04:06
300016,2,豆包说今天主力诱多出货了，明天开盘赶紧跑,03-30 05:26
300016,2,北陆药业董事方志刚因病逝世 董事会人数降至8人,03-30 04:16
300016,2,隔壁塞力医疗涨停了，主力加油吧，今天要是涨八个点，就有人哭晕厕所里了,03-30 01:19
300016,2,放量放量,03-30 02:25
300016,2,20厘米白搭了！给你机会你不中用啊！,03-30 02:20
300016,2,这栗就是这样冲高就回落,03-30 01:59
300016,2,下午跌停板！！消灭散户！！！给我杀！！！狠狠的杀！,03-30 11:58
300016,2,增发不要碰,03-30 01:01
300016,2,还是上引线，主力一如既往的做t，股性不行啊，一上10块就须谨慎。,03-30 12:30
300016,2,潜在的十倍股，龙头股！,03-30 07:46
300016,2,十元真难站稳,03-30 11:38
300016,2,没人玩的量化票,03-30 11:16
300016,2,今天有出货嫌疑，分时开盘快速拉升，最高点1min成交了5.2w手，然后一路慢跌下,03-30 10:43
300016,2,弱了点，,03-30 10:56
300016,2,跑得快的人聪明啊！,03-30 10:36
300016,2,幸亏老夫跑得快,03-30 09:55
300016,2,冲高就跑，切记！大盘起码调整半年。,03-30 10:30
300016,2,哎，终究是扶不上的,03-30 10:22
300016,2,板块跌，我也跌，我受板块影响，板块涨，我不涨，我和板块不一样。,03-30 10:20
300016,2,明天如果有机会上涨两个点，毫不犹豫就出来！！！！,03-29 10:53
300016,2,这票还是不行看看龙就知道它不行,03-30 09:49
300016,2,北绿=白涨,03-30 09:46
300016,2,今天能来个二十厘米吗,03-30 09:32
300016,2,牛,03-30 09:31
300016,2,$北陆药业(SZ300016)$,03-30 08:10
300016,2,国外战事频发，国内疫情防控，医药治疗需求与日俱增这家药企创新创业能力强业绩增长股,03-30 08:09
300016,2,仍在继续坚持的股友们：千万不可忽视募资扩产重点，珍惜手中拥有的廉价筹码啊。,03-29 09:37
300016,2,今天大跌,03-30 05:51
300016,2,现在回头看，密令阻击兄台的观点一直是正确的。,03-29 08:02
300016,2,下周再回调，可以考虑买，6个板,03-29 05:48
