股票代码,页码,标题,时间
300008,1,天海防务：2025年归母净利润同比增长115.37%，拟10派0.32元,03-30 08:16
300008,1,军工股该连板了！有个消息令人吃惊！,04-02 10:22
300008,1,业绩承诺未兑现致巨额商誉损失，天海防务起诉金海运原股东李露索赔1.48亿元：一审败诉且自行担费，另一违规报价致1500万元退款索赔案待开庭,04-03 04:12
300008,1,别幻想了！人家做空就能赚钱！量化这波赚大了，可能有的人还不知道有融券，而且是T＋,04-04 08:25
300008,1,140亿订单难道是假的？,04-03 10:14
300008,1,公司140亿订单在手，业务量更是排到2028年，股价如此持续下跌，公司难道不考虑,04-03 12:03
300008,1,不管大盘如何，这厮每天都是勇往直下的撕跌，丑勾史,04-03 10:04
300008,1,根据这些公开信息包括业绩高速增长，能得出140亿订单在手是真实的！,04-03 10:03
300008,1,这个没有激光雷达,04-03 09:44
300008,1,今年三千七到四千二运动吧！天海回五元！下星期见六！,04-03 08:08
300008,1,天海防务几年就已经计提商誉损失，以后打的官司赢一个收入一个利好！,04-03 06:14
300008,1,下周一还有一波大跌，进场机构还会开展大规模的击杀，有了不好消息推动，事半功倍。,04-03 02:58
300008,1,刘强东一夜之间投200亿在广东海上游艇，天海防务快退市市喽,04-03 12:53
300008,1,爷爷我又来了！,03-09 10:00
300008,1,6.5，6.2，5.6……越跌越加，然后放半年以上看，必有厚报,04-03 04:40
300008,1,我觉的应该是没有了,04-03 04:15
300008,1,3月31日，天海防务全资子公司江苏大津重工有限公司为中国铁建大桥工程局集团有限公,04-03 03:20
300008,1,金山护卫！,04-03 03:15
300008,1,真垃圾。,04-03 02:57
300008,1,。,04-03 02:57
300008,1,下礼拜破7,04-03 02:54
300008,1,惨不忍睹，天海防涨,04-03 02:52
300008,1,为什么不跌破7.18元？再加点量，如破7元我买全仓。,04-03 02:48
300008,1,卧槽，25卖了想做个短T破18不会被割了吧,04-03 02:13
300008,1,识防务者为俊杰。,04-03 02:22
300008,1,熊市来了，大家快逃吧！,04-03 02:19
300008,1,下来把别装了，17挂好了破底反弹,04-03 02:15
300008,1,……,04-03 02:09
300008,1,M,04-03 02:08
300008,1,量化来回收割,04-03 02:08
300008,1,托单必跌破量化操作,04-03 02:07
300008,1,lj,04-03 02:04
300008,1,无量的反弹是？,04-03 01:32
300008,1,很多个股回到3000甚至下方但大盘还在3800之上,04-03 01:18
300008,1,兰货，兰货，清仓看热闹,04-03 01:46
300008,1,清仓了，完败。,04-03 01:40
300008,1,我已从A股钱转出去了放银行利息每天吃顿早餐挺好的，投股票亏钱还亏精力,04-03 01:20
300008,1,公司都欠了一勾子的债了，哪里有钱回购？放心吧，天不会塌下来。只是洗筹码而已。,04-03 01:04
300008,1,见底了，二次探底，有机构入场,04-03 10:14
300008,1,什么情况？见底了吗,04-03 12:46
300008,1,误算了上海柠的尿性了,04-03 12:33
300008,1,为什么要屏闭贴子，心虚吧！！！！,04-03 09:47
300008,1,这只股今天看要破七了9.5的成本啥时候回本呀,04-03 10:41
300008,1,不就100来亿的盘子，主力卖不完的筹码？,04-03 10:17
300008,1,我谢谢你，让我认清了股市。业绩好的坚决不能买。再见了这个市场。再见了朋友们,04-03 10:23
300008,1,最失败最执着的一次9.53满仓到现在！头大！,04-01 09:28
300008,1,高盛入驻,04-02 10:21
300008,1,撤了撤了。都是散户套牢盘。跌了30个点。填海我也不想着回本了，大概率还要往下跌。,04-03 11:13
300008,1,跌不动了,04-03 11:12
300008,1,733是怎么回事？,04-03 10:50
300008,1,这个黑庄肯定过不了三伏,04-03 10:46
300008,1,年底20,04-03 10:42
300008,1,亏了30个点了，还能回本嘛,04-03 10:17
300008,1,7.32500万,04-03 10:36
300008,1,崩塌了，没有最低只有更低,04-03 10:21
300008,1,砸盘没节操了,04-03 10:18
300008,1,全是犟种，你们犟种不割肉，怎么涨,04-03 10:18
300008,1,跌吧，无所谓，跟主力一起耗着,04-03 10:17
300008,1,可以买入，逢低吸,04-03 09:53
300008,1,输了没办法,04-03 10:14
300008,1,动荡不安的国际局势，稀乱的市场，低迷的全球经济，地球上还能适应人类的生存吗,04-03 10:11
300008,1,买了这股要命,04-03 10:08
300008,1,李露财务造假怎么就轻判了,04-03 10:07
300008,1,逢低买入，一直买,04-03 09:52
300008,1,找死,04-03 09:57
300008,1,这是要朝死的整呀,04-03 09:52
300008,1,板块在涨，有意下跌！你的业绩是真是假？是有意欺骗股民意？请有部门彻查！！！,04-03 09:46
300008,1,人才中的极品，公司有严重的管理问题,04-03 09:53
300008,1,天海防务:关于向江苏金海运科技有限公司原股东提起诉讼的进展公告,04-02 05:23
300008,1,SBLJ,04-03 09:48
300008,1,完全被量化控制，不要操作就行了,04-03 09:47
300008,1,量化控盘操纵，几年了，即使业绩反转，还是阴阳怪气的走势！,04-03 09:45
300008,1,天天这样！！！,04-03 09:43
300008,1,的！出不完的货！,04-03 09:40
300008,1,果然，依旧垃圾,04-03 09:35
300008,1,高开也低走？低开还是低走？要点Lian不？,04-03 09:32
300008,1,天海防务：融资净偿还606.62万元，融资余额7.8亿元,04-03 08:59
300008,1,这股估计慢慢往五块钱靠拢,04-03 06:47
300008,2,高盛买入太平洋和天海防务不一样，高盛买入天海防务是持续性买入，太平洋是炒一波就走,04-03 11:59
300008,2,10.1元还套着呢,04-03 11:56
300008,2,公司140亿订单在手，业务量更是排到2028年，股价如此持续下跌，公司难道不考虑,04-03 12:02
300008,2,……,04-03 11:18
300008,2,看来他只跟海洋经济，其他与其无关！四不象,04-03 10:42
300008,2,看来要破前低7.18元了。,04-03 09:52
300008,2,有意作弄股民，啃害股民，还回血汗钱！！！,04-03 09:42
300008,2,啃害股民的！,04-03 09:40
300008,2,我去，败诉了。别说没影响，大利空,04-02 08:55
300008,2,上海港的海上算力中心，用海水给算力降温。不知道和天海防务有关系吗,04-02 10:26
300008,2,半年之内不用看,04-02 06:37
300008,2,还有犬吠吗？哈哈哈哈，明天就给你破7,04-02 08:19
300008,2,磨底中,04-02 06:48
300008,2,原油期货爆涨了.咋办他不跟能源股,04-02 06:46
300008,2,实在不行ST吧，再不行价格打到1元,04-02 06:06
300008,2,真实股价应该在14块以上,04-02 08:15
300008,2,大级别的震荡横盘，6.72缺口等你！,04-02 04:13
300008,2,为什么业绩这么好的票社保基金没有重仓，难道他不聪明没有发现吗？,04-02 03:05
300008,2,这货不涨没理由呀,04-02 02:38
300008,2,这个股还有个很大的问题是：融资盘介入太高，处于历史高位,04-02 03:30
300008,2,4月底才会有希望！,04-02 03:06
300008,2,天海防务最大的毛病是没有超过5%以上的股份占比再卖就不会公告了，难怪都是量化短线,03-17 09:30
300008,2,最新消息造的船漏水了,04-02 02:43
300008,2,天海防务改名天海防涨，大家没意见吧？,04-02 01:45
300008,2,过清明了？,04-02 02:22
300008,2,跳一下水，恐慌盘不就出来了么！,04-02 02:06
300008,2,不按套路出牌。下午看着你。,04-02 12:12
300008,2,可以形容太了,04-02 02:12
300008,2,现在的日子整天都在解套入坑，出坑进套。,04-02 01:58
300008,2,大家能不能齐心协力一起举报这股量化交易！？,04-01 10:49
300008,2,天海防务明天肯定跌三个点，拭目以待吧,04-01 11:07
300008,2,SBLJ,04-02 01:05
300008,2,割了，祝留下的发财！,04-02 01:10
300008,2,拿着吧最起码这货还是为数不多的可以分红的,04-02 01:15
300008,2,江龙拉直线了，你不跟？,04-02 11:48
300008,2,越来越佩服自己，前几天勇敢割肉卖了，现在回头看看，卖掉的决定是正确的,04-02 12:01
300008,2,这股重大问题是本周上面230万手的套牢盘怎么办？,04-02 11:38
300008,2,看看明天有拉没,04-02 11:31
300008,2,一支穿云箭，就会拨开云雾,04-02 11:14
300008,2,昨天的高开低走，至少要阴跌一周。才有下一次的高开低走,04-02 11:21
300008,2,哇！是有什么雷吗？这么横盘阴跌？,04-02 11:18
300008,2,主力没事正坐在办公室喝着茶发笑,04-02 11:17
300008,2,你们认为它不能再跌的时候就是套你没商量的好时候,04-02 11:15
300008,2,从未见过如此厚颜无耻之股,04-02 10:36
300008,2,每次发了利好就一直跌。就是骗大家进来接盘,04-02 11:11
300008,2,怎么举报这个，我感觉恶意做空,04-02 11:10
300008,2,不套你们怎么长线投资,04-02 10:57
300008,2,再多的利好也是阴跌谁进这股谁挨闷棍扯淡,04-02 10:40
300008,2,等大跌到4块钱在来看了,04-02 10:36
300008,2,天天吹的人真搞笑，这股就是来让你们搞笑的吧,04-02 10:35
300008,2,没完没了,04-02 10:32
300008,2,总有一天要去这家公司看看。到底怎么个事,04-02 10:32
300008,2,崩了算了，！别装了,04-02 10:15
300008,2,猪力只出货资金净流出，没戏,04-02 10:29
300008,2,主力有病吧。你的天然气呢？,04-02 10:24
300008,2,这13真臭,04-02 10:24
300008,2,割了，不玩了！再也不见,04-02 10:21
300008,2,这个股去是吧。永远不要出现在股市里，。不论大盘怎么样，都跟跌不跟涨,04-02 10:18
300008,2,$天海防务(SZ300008)$,04-02 10:17
300008,2,47加了半仓,04-02 10:16
300008,2,雷科拉了六个点，还不跟上。,04-02 10:10
300008,2,看看雷科，再看看它，真是,04-02 09:54
300008,2,这家伙吃这么饱了还吃。,04-02 10:02
300008,2,松发订单还没有天海一半多，天海140亿订单在手，股价如此瘟,04-02 09:52
300008,2,天海这个天杀的主力，你小弟松发订单还没有你多，又要涨停了！,04-02 09:49
300008,2,吹几句牛：散户多是事实；什么报都不管用，就得看资金意愿和风向；不是妖股苗子，别Y,04-02 09:48
300008,2,被量化控制的股票，唯一的对抗就是，如果相信业绩就扛！,04-02 09:47
300008,2,一两下就完事儿，这东东不是一般的萎。,04-02 09:47
300008,2,关键看一季报，年报有预披所以没有意义。但愿有好消息。不知道董秘可不可以预披一下一,04-02 04:00
300008,2,你TM一季度难道亏十个亿,04-02 09:29
300008,2,招商轮船业绩出来两个涨停业绩出来估计两个跌停,04-02 09:37
300008,2,就凭风电平台，天海防务占据国内百分之40的业务量，就能值20元一股，何况还有无人,03-30 03:08
300008,2,25年年报业绩翻倍确实惊艳，正常这种140亿订单在手，股价最少二十元一股才合理，,04-02 09:15
300008,2,估计又是高开低走，然后跌三个点,04-02 09:20
300008,2,天海防务：融资净买入1117.39万元，融资余额7.86亿元,04-02 09:05
300008,2,跌破5元，老子再回来捡便宜！,04-02 07:32
300008,2,大力发展风电，绿色能源,04-02 06:59
300008,2,天海防务:关于江苏大津重工有限公司业绩承诺完成情况说明的公告,03-30 07:05
300008,2,股票涨跌有这么简单吗？,04-02 06:25
300009,1,深圳“细胞十条”发布 推动细胞与基因产业提速发展,04-04 02:20
300009,1,安科生物一曲妥珠单抗分析.2025年(放量初期)：约3亿出头.2026年(医保+,04-04 03:43
300009,1,这个股戾气好重！基本面不挺好的吗？,04-04 08:07
300009,1,要求不高，今年股价能涨到13.5元就行。,04-02 07:09
300009,1,安科生物的曲妥珠单抗(安科)乳腺癌和胃癌必用药，主流规格：440mg集采落地后主,04-04 03:42
300009,1,开始回调,04-04 06:20
300009,1,去年8月15日13元始，反反复复，但总体趋势一路下跌。3月23日（一）达8.66,04-04 10:11
300009,1,34股今日获机构买入评级,04-03 05:55
300009,1,无奈这么好的利好，在今天指数的狂风暴雨中显得微不足道，也没扛住下跌的可悲局面！,04-03 11:03
300009,1,个人安科看到35以上。。。。看看未来能不能走上去,04-01 05:20
300009,1,10块钱的位置不好过啊，还得磨。。。。啥时候在10块钱能放量突破，就是上攻的时候,03-30 04:39
300009,1,恒生电子目标价涨幅超76% 安科生物、丸美生物评级被调低｜券商评级观察,04-03 08:47
300009,1,这段时间，凡事我买的股，后面都是割肉走！今天我来这里了。能不能打破魔咒,04-03 02:33
300009,1,安科生物:关于召开2025年度网上业绩说明会的公告,04-03 06:49
300009,1,尾盘必然上9.9元，为下周做铺垫。,04-03 02:49
300009,1,收盘9.83,04-03 02:51
300009,1,效益好的优质股涨不过St抱团垃圾股！价值投资如何体现.....,04-03 02:26
300009,1,你公布效益都好涨不过抱团垃圾股和St……股市咋炒....,04-03 02:05
300009,1,效益好也不涨！涨不过St……可笑,04-03 01:49
300009,1,动不动发一堆公告的股是涨不了的，发公告就为了出货，没有其他,04-03 01:25
300009,1,这个市场所谓的价值投资真的坏，全是亏损股在涨，有业绩的大多数反而跌的猛，哎,04-03 11:38
300009,1,中国首个核医学1类创新药获批；神州细胞筹划港股上市｜医药早参,04-03 07:04
300009,1,60天线横盘。,04-03 11:08
300009,1,送礼花，哈怂,04-03 10:14
300009,1,想绣我出局，我死拿不走，不回本走不了,04-03 10:40
300009,1,安科生物在医疗股票中不算差的，看看迈瑞医疗，更差,04-03 10:38
300009,1,医药里最菜的一只,04-03 09:48
300009,1,@细致的康艳鸡兄快回来开跌啦！,04-03 09:29
300009,1,在砸，坚决补仓，这是年内最后、最低的上车机会。,04-03 09:30
300009,1,药明康德是专注于创新药领域的全球领先企业，其业务涵盖创新药研发、生产及服务的全产,04-02 10:22
300009,1,安科生物：公司参股公司博生吉公司以及阿法纳公司都在布局In vivo CAR-T,04-02 05:39
300009,1,安科生物：董事会审议通过《关于聘任公司高级管理人员的议案》,04-02 07:37
300009,1,开始跌吧,04-03 09:34
300009,1,给个补仓机会，拜托,04-03 09:21
300009,1,安科生物：融资净买入724.18万元，融资余额6.02亿元,04-03 08:58
300009,1,慢涨是真涨！这票的钱哪有这么容易赚？用我持有这票几年的感觉看今大市越跌他越强！,04-03 07:51
300009,1,重磅：美国宣布将对进口专利药及制药成分加征100%关税,04-03 05:37
300009,1,博安13年，没成绩，怎么一到安科就能封神？,04-03 05:17
300009,1,以前搞得都不算创新药，都是传统的，来个搞创新药的专家，好事情,04-02 06:24
300009,1,高手预测一下明天怎么走，畅所欲言,04-02 09:41
300009,1,$安科生物(SZ300009)$,04-02 06:34
300009,1,安科生物：2026年曲妥珠单抗销售目标仍是收入及利润大幅增长,04-02 01:28
300009,1,重磅引才！安科生物聘任生物医药领军专家窦昌林博士为首席执行官兼首席科学家,04-02 03:56
300009,1,安科生物：“PDL1×4-1BB”双特异性抗体药物HK010目前处于Ib/IIa期临床阶段,04-02 05:15
300009,1,国际化布局：公司正积极寻求国际合作，通过在美国、欧洲举行的国际会议与国际公司进行,04-02 01:50
300009,1,l利空出尽尽利好，起飞,04-02 08:03
300009,1,各位放心，安科一定会让各位失望的,04-02 08:00
300009,1,新官上任三把火，窦昌林博士的上任安科海内外有大的动作估计,04-02 07:42
300009,1,安科生物：公司战略合作的品种注射用隆培生长激素于2026年1月获批上市,04-02 05:15
300009,1,安科生物：关于聘任窦昌林博士为公司首席执行官兼首席科学家的公告,04-02 05:39
300009,1,。窦昌林何方神仙,04-02 01:17
300009,1,安科生物聘任窦昌林博士为公司首席执行官兼首席科学家,04-02 01:35
300009,1,终于来了一个懂技术的了,04-02 06:23
300009,1,耐心等待12元再买入,04-02 02:31
300009,1,安科生物:300009安科生物投资者关系管理信息20260402,04-02 12:13
300009,1,安科生物：公司的曲妥珠单抗“安赛汀”2023年底获批上市,04-02 05:16
300009,1,主要负责公司创新药研发体系建设、前沿技术平台搭建、全球化布局、重点管线推进及研发,04-02 04:04
300009,1,【安科生物：聘任窦昌林为公司首席执行官兼首席科学家】安科生物4月2日公告，公司第,04-02 02:38
300009,1,博安生物(06955.HK)宣布，由于执行董事窦昌林已达法定退休年龄，自愿辞去公,04-02 01:53
300009,1,博安生物的走势也不行啊,04-02 03:38
300009,1,还得下来,04-02 03:01
300009,1,午间公告：安科生物聘任窦昌林博士为公司首席执行官兼首席科学家,04-02 12:03
300009,1,留下一堆烂摊子子,04-02 02:17
300009,1,公司拿出2亿增持自家股票，比发什么都管用,04-02 02:16
300009,1,安科生物：窦昌林获聘首席执行官兼首席科学家,04-02 12:32
300009,1,下午5个点,04-02 02:08
300009,1,安科生物：聘任窦昌林为公司首席执行官兼首席科学家,04-02 12:29
300009,1,散了吧,04-02 01:20
300009,1,股价代表一切，又一个骗吃骗喝拿高薪的来了,04-02 01:10
300009,1,千万年薪聘请全球顶级CEO这个钱开得值得！,04-02 01:02
300009,2,你咋啦？爬地上一年多了！该涨了吧.....,04-03 01:49
300009,2,挺好的调整，和预想的一样，其实股票就是那么回事，当你明白了他的运行规律，就不会那,04-03 10:09
300009,2,3月26日（四）近期最低量反转以来，连续5日小涨，温和放量，显示有源源不断资金悄,04-03 06:01
300009,2,正常来讲，往下砸两天的可能性是存在的。。。。如果板块强势，就不好说了，，啥时候能,04-02 10:12
300009,2,安科生物的产品线大发展。已上市：生长激素，曲妥珠单抗(安赛汀)，长效FSH。临床,04-03 08:49
300009,2,挺好的，结束了，恭喜大家又厮混了一天，连续5根阳线，今天强势补了缺口，也打到了压,04-02 03:05
300009,2,板块整体打到压力位了，挺好，站上10块，好好洗盘吧也是成功补了缺口，顺道解放一下,04-02 11:21
300009,2,mgb.又有下跌的理由了,04-02 01:14
300009,2,睡着了吗？,04-02 01:09
300009,2,中午发的利好骗人进来了吧,04-02 01:05
300009,2,安科生物:关于聘任窦昌林博士为公司首席执行官兼首席科学家的公告,04-02 11:48
300009,2,涨停板压力位1085元，突破真有可能放量涨停板，拭目以待,04-02 12:49
300009,2,：聘任窦昌林为公司首席执行官兼首席科学家】安科生物4月2日公告，公司第九届董事会,04-02 12:49
300009,2,分红有没有到账，在账户哪能看到？,04-02 11:40
300009,2,公司中午发利好肯定希望股价有表现，看看机构买不买帐了,04-02 12:45
300009,2,【调研快报】安科生物接待天风证券等30家机构调研,04-02 12:18
300009,2,安科生物:关于第九届董事会第三次会议决议的公告,04-02 11:48
300009,2,拉基又错过这波创新药大涨的节奏,04-02 11:45
300009,2,先出来,04-02 11:19
300009,2,底部割了一半的肉不跌下来就是不买,04-02 11:22
300009,2,远远落后板块，你哪哪都好，就是股价不好,04-02 10:44
300009,2,这股不涨是因为它没亏钱，要巨亏的股才会大涨,04-02 11:03
300009,2,复权后看也是10多年未涨了，一个年年盈利增长的公司，股价10多年不涨，亏损的公司,04-02 11:12
300009,2,套牢了就安心做股东吧！年年有分红还不错。,04-02 11:01
300009,2,起飞宝贝，今天你是最靓的仔，哈哈,04-02 11:08
300009,2,今天走势：一路逼空，资金缓缓流入，但方向是温和上行，坚定如山，为下周大涨做铺垫。,04-02 10:59
300009,2,跌起来，这臭拉基比谁都快,04-02 10:57
300009,2,美国癌症研究协会（AACR）年会将于4月17日至22日召开。市场预期有重磅成果亮,04-02 07:24
300009,2,我好像理解了一点，虽慢但却稳健，走加速就是大阳,04-02 10:35
300009,2,拉基，学学常山药业,04-02 10:38
300009,2,去美国展示的还有几家,04-02 10:31
300009,2,拉的太磨叽了，又在骗人上车,04-02 10:30
300009,2,补上缺口了，今天基本这样了。。。,04-02 10:30
300009,2,上午10：08分，本周换手率同上周，成交量几乎同上周，金额较上周略高。本周确有资,04-02 10:19
300009,2,送礼花，你太缺德,04-02 10:18
300009,2,看看睿智医药，你个拉基,04-02 10:15
300009,2,津药药业五个板了，你个拉基,04-02 10:09
300009,2,小科子冲冲冲，先把缺口封了加油,04-02 10:07
300009,2,用点力，妹妹要丝滑，哈哈,04-02 09:59
300009,2,九块八，前期成交密集区，就看新来的多头实力有多强了，在这一带，筹码要多少就有多少,04-02 09:54
300009,2,今天要跣5个点？,04-02 09:52
300009,2,别的医药股昨天涨多少，烂科你涨多点，没有点数？,04-02 09:40
300009,2,冲冲冲,04-02 09:45
300009,2,资金稳稳、有序入场，下周了期。,04-02 09:46
300009,2,安科生物：融资净买入290.39万元，融资余额5.94亿元,04-02 08:58
300009,2,安科生10元下方都是空头陷阱。一直坚持这个观点，创新药的春天已经来了。大量量化蜂,04-02 04:09
300009,2,977这个数字让我放走的航天科技，东材科技，今天的安科就像它们一样展翅高飞。,04-02 05:54
300009,2,安科业绩符合预期。3月27日（五）开始价升量增，速率较缓，走势稳健。生物医药板块,04-02 05:41
300009,2,战乱之后必有病菌传播，生物医药是未来几个月主线,04-01 11:26
300009,2,请问公司在研产品积极推进的“HuA21注射液”“AK2024注射液”“HK010,04-01 08:45
300009,2,涨幅依然逊于板块！,04-01 10:37
300009,2,今天美诺华一直在水下，没反包。。津药药业4板，明天很关键啊，看竞价如果今天大涨的,04-01 09:51
300009,2,短线涨了几个点就不道他原来啥样了长期还得破低,04-01 09:29
300009,2,请问公司在几个月前说的博生吉公司的创新药对外授权合作有进展吗？,03-31 05:40
300009,2,轮到创新药作主线了，安科生物叁股的博生吉在谈海外授权，几个月了一旦公布即踩上风口,04-01 07:29
300009,2,来吧里巡视一圈，最近有点得瑟,04-01 07:31
300009,2,我想请问一下，安科生物为啥股价市盈率这么低？,04-01 07:07
300009,2,终于轮到医药板块了，希望安科做头羊,04-01 05:16
300009,2,安科生物：参股公司博生吉安科自主研发的“PA3-17注射液”目前已经进入关键性II期临床试验,03-31 06:04
300009,2,舒服，带劲，明天继续，30000手待丝滑，哈哈,04-01 03:21
300009,2,今天虽然涨了，但还是落后板块的涨幅呀，不能说算强吧。,04-01 04:37
300009,2,板块涨6个点啊，真厉害，难怪不遵守规律了,04-01 04:05
300009,2,对不起所有投资安科的股东，欠所有股东两个涨停,04-01 02:55
300009,2,板块~部涨不过？,04-01 02:27
300009,2,安科就是异类，礼花太坏,04-01 02:05
300009,2,这成交量简直是太完美了啊，真是一幅杰作，慢慢来，不要快，慢点,04-01 02:34
300009,2,冲8角,04-01 02:35
300009,2,社保开始缓慢增仓了，大家不要倒在黎明前,04-01 10:13
300009,2,虽然只有一层仓位，73还是清了，保住利润。今日弱于板块明日回调的力度可不会弱,04-01 01:58
300009,2,你不是创业板吗？,04-01 01:57
300009,2,怂。。。ST涨的都比你爽。。你还连发利好呢。。。。,04-01 01:51
300009,2,弱。。。,04-01 01:49
300009,2,板块已经向阳而生，强势的已经在收获利润了,04-01 10:23
300009,2,国家定调的。。。你自己都不看好吗。。。不如报团垃圾股和ST。。。。,04-01 01:44
300009,2,起飞宝贝，持续持有，18元再丝滑了，哈哈,04-01 12:37
300009,2,我我在底下割肉你就真涨啊,04-01 01:09
300009,2,你发利好还这么弱吗。。。。,04-01 01:13
300010,1,大佬们，8.6的本，年府前还有望回本吗？不会阴跌到两三块儿吧。,04-04 10:46
300010,1,9.57，跌38个点了啊，这是要腰斩了,04-04 11:40
300010,1,什么时候才能解套6.3真难,04-02 04:42
300010,1,老夫掐指一算，这股应该改名，你敢斗神，早完晚完早晚都的完,04-03 09:10
300010,1,迟早回3元，还有9亿融资盘加10W散户，都等着被套个四五年吧，不说不定明年就退市,04-03 06:23
300010,1,最近一直在读关于AI大模型方面的资料，可以确认的是当前处于第四次工业革命！在大模,04-03 02:21
300010,1,转融通来了割韭菜,04-03 05:29
300010,1,下周一肯定不会跌了,04-03 04:19
300010,1,垃圾股～～～～,04-03 03:05
300010,1,我亏了11个点了,04-03 10:32
300010,1,S在这里了，永远都解不了套了。不脱层皮不放出去了。,04-03 01:40
300010,1,窦昕8毛照样赚几倍，12月底解股大赚吃肉,04-03 02:25
300010,1,成交量比24年9月22日之前都低了真台亮的是好股市！,04-03 02:12
300010,1,看这样子缩量底背离，直接躺平，不买不卖放假几天，,04-03 02:06
300010,1,我不担心它随大盘下跌，我担心的是大盘上去，它回不去！每次都这样,04-03 01:44
300010,1,5.932000万,04-03 01:59
300010,1,这个位置，可以入了，算朱莉发福利,04-03 01:40
300010,1,还好是创业板，板块拉升了，这还,04-03 01:37
300010,1,中国高科和行动教育的主力高度控盘，不跟大盘走势，其他的都不行,04-03 01:31
300010,1,玛德，教育板块真垃圾,04-03 01:15
300010,1,到5.79补一半,04-03 01:09
300010,1,下午能不能红？,04-03 12:23
300010,1,跌一两毛，涨一两分，,04-03 01:04
300010,1,这3人真的都没本事？,04-03 11:49
